{
  "model_name": "Claude-Opus-4.8",
  "model_id": "anthropic/claude-opus-4.8",
  "timestamp": "2026-06-10T07:34:11.918489+00:00",
  "prompt_version": "2.0",
  "temperature": 0.3,
  "group_stage_matches": [
    {
      "match_id": "GS-01",
      "stage": "group_stage",
      "group": "A",
      "home_team": "MEX",
      "away_team": "RSA",
      "predicted_result": "home",
      "predicted_score": {
        "home": 2,
        "away": 0
      },
      "probs": {
        "home": 0.6,
        "draw": 0.25,
        "away": 0.15
      }
    },
    {
      "match_id": "GS-02",
      "stage": "group_stage",
      "group": "A",
      "home_team": "KOR",
      "away_team": "DEN",
      "predicted_result": "away",
      "predicted_score": {
        "home": 1,
        "away": 2
      },
      "probs": {
        "home": 0.3,
        "draw": 0.28,
        "away": 0.42
      }
    },
    {
      "match_id": "GS-03",
      "stage": "group_stage",
      "group": "A",
      "home_team": "MEX",
      "away_team": "KOR",
      "predicted_result": "home",
      "predicted_score": {
        "home": 2,
        "away": 1
      },
      "probs": {
        "home": 0.48,
        "draw": 0.28,
        "away": 0.24
      }
    },
    {
      "match_id": "GS-04",
      "stage": "group_stage",
      "group": "A",
      "home_team": "RSA",
      "away_team": "DEN",
      "predicted_result": "away",
      "predicted_score": {
        "home": 0,
        "away": 2
      },
      "probs": {
        "home": 0.22,
        "draw": 0.28,
        "away": 0.5
      }
    },
    {
      "match_id": "GS-05",
      "stage": "group_stage",
      "group": "A",
      "home_team": "MEX",
      "away_team": "DEN",
      "predicted_result": "draw",
      "predicted_score": {
        "home": 1,
        "away": 1
      },
      "probs": {
        "home": 0.35,
        "draw": 0.32,
        "away": 0.33
      }
    },
    {
      "match_id": "GS-06",
      "stage": "group_stage",
      "group": "A",
      "home_team": "RSA",
      "away_team": "KOR",
      "predicted_result": "away",
      "predicted_score": {
        "home": 1,
        "away": 2
      },
      "probs": {
        "home": 0.3,
        "draw": 0.28,
        "away": 0.42
      }
    },
    {
      "match_id": "GS-07",
      "stage": "group_stage",
      "group": "B",
      "home_team": "CAN",
      "away_team": "ITA",
      "predicted_result": "away",
      "predicted_score": {
        "home": 1,
        "away": 2
      },
      "probs": {
        "home": 0.3,
        "draw": 0.28,
        "away": 0.42
      }
    },
    {
      "match_id": "GS-08",
      "stage": "group_stage",
      "group": "B",
      "home_team": "QAT",
      "away_team": "SUI",
      "predicted_result": "away",
      "predicted_score": {
        "home": 0,
        "away": 2
      },
      "probs": {
        "home": 0.18,
        "draw": 0.26,
        "away": 0.56
      }
    },
    {
      "match_id": "GS-09",
      "stage": "group_stage",
      "group": "B",
      "home_team": "CAN",
      "away_team": "QAT",
      "predicted_result": "home",
      "predicted_score": {
        "home": 2,
        "away": 0
      },
      "probs": {
        "home": 0.58,
        "draw": 0.26,
        "away": 0.16
      }
    },
    {
      "match_id": "GS-10",
      "stage": "group_stage",
      "group": "B",
      "home_team": "ITA",
      "away_team": "SUI",
      "predicted_result": "home",
      "predicted_score": {
        "home": 2,
        "away": 1
      },
      "probs": {
        "home": 0.45,
        "draw": 0.3,
        "away": 0.25
      }
    },
    {
      "match_id": "GS-11",
      "stage": "group_stage",
      "group": "B",
      "home_team": "CAN",
      "away_team": "SUI",
      "predicted_result": "draw",
      "predicted_score": {
        "home": 1,
        "away": 1
      },
      "probs": {
        "home": 0.34,
        "draw": 0.32,
        "away": 0.34
      }
    },
    {
      "match_id": "GS-12",
      "stage": "group_stage",
      "group": "B",
      "home_team": "ITA",
      "away_team": "QAT",
      "predicted_result": "home",
      "predicted_score": {
        "home": 3,
        "away": 0
      },
      "probs": {
        "home": 0.72,
        "draw": 0.18,
        "away": 0.1
      }
    },
    {
      "match_id": "GS-13",
      "stage": "group_stage",
      "group": "C",
      "home_team": "BRA",
      "away_team": "MAR",
      "predicted_result": "home",
      "predicted_score": {
        "home": 2,
        "away": 1
      },
      "probs": {
        "home": 0.55,
        "draw": 0.27,
        "away": 0.18
      }
    },
    {
      "match_id": "GS-14",
      "stage": "group_stage",
      "group": "C",
      "home_team": "HAI",
      "away_team": "SCO",
      "predicted_result": "away",
      "predicted_score": {
        "home": 0,
        "away": 2
      },
      "probs": {
        "home": 0.22,
        "draw": 0.28,
        "away": 0.5
      }
    },
    {
      "match_id": "GS-15",
      "stage": "group_stage",
      "group": "C",
      "home_team": "BRA",
      "away_team": "HAI",
      "predicted_result": "home",
      "predicted_score": {
        "home": 3,
        "away": 0
      },
      "probs": {
        "home": 0.8,
        "draw": 0.13,
        "away": 0.07
      }
    },
    {
      "match_id": "GS-16",
      "stage": "group_stage",
      "group": "C",
      "home_team": "MAR",
      "away_team": "SCO",
      "predicted_result": "home",
      "predicted_score": {
        "home": 2,
        "away": 1
      },
      "probs": {
        "home": 0.48,
        "draw": 0.28,
        "away": 0.24
      }
    },
    {
      "match_id": "GS-17",
      "stage": "group_stage",
      "group": "C",
      "home_team": "BRA",
      "away_team": "SCO",
      "predicted_result": "home",
      "predicted_score": {
        "home": 2,
        "away": 0
      },
      "probs": {
        "home": 0.68,
        "draw": 0.2,
        "away": 0.12
      }
    },
    {
      "match_id": "GS-18",
      "stage": "group_stage",
      "group": "C",
      "home_team": "MAR",
      "away_team": "HAI",
      "predicted_result": "home",
      "predicted_score": {
        "home": 2,
        "away": 0
      },
      "probs": {
        "home": 0.62,
        "draw": 0.24,
        "away": 0.14
      }
    },
    {
      "match_id": "GS-19",
      "stage": "group_stage",
      "group": "D",
      "home_team": "USA",
      "away_team": "PAR",
      "predicted_result": "home",
      "predicted_score": {
        "home": 2,
        "away": 1
      },
      "probs": {
        "home": 0.48,
        "draw": 0.28,
        "away": 0.24
      }
    },
    {
      "match_id": "GS-20",
      "stage": "group_stage",
      "group": "D",
      "home_team": "AUS",
      "away_team": "TUR",
      "predicted_result": "away",
      "predicted_score": {
        "home": 1,
        "away": 2
      },
      "probs": {
        "home": 0.28,
        "draw": 0.28,
        "away": 0.44
      }
    },
    {
      "match_id": "GS-21",
      "stage": "group_stage",
      "group": "D",
      "home_team": "USA",
      "away_team": "AUS",
      "predicted_result": "home",
      "predicted_score": {
        "home": 2,
        "away": 1
      },
      "probs": {
        "home": 0.52,
        "draw": 0.27,
        "away": 0.21
      }
    },
    {
      "match_id": "GS-22",
      "stage": "group_stage",
      "group": "D",
      "home_team": "PAR",
      "away_team": "TUR",
      "predicted_result": "draw",
      "predicted_score": {
        "home": 1,
        "away": 1
      },
      "probs": {
        "home": 0.32,
        "draw": 0.32,
        "away": 0.36
      }
    },
    {
      "match_id": "GS-23",
      "stage": "group_stage",
      "group": "D",
      "home_team": "USA",
      "away_team": "TUR",
      "predicted_result": "draw",
      "predicted_score": {
        "home": 1,
        "away": 1
      },
      "probs": {
        "home": 0.38,
        "draw": 0.3,
        "away": 0.32
      }
    },
    {
      "match_id": "GS-24",
      "stage": "group_stage",
      "group": "D",
      "home_team": "PAR",
      "away_team": "AUS",
      "predicted_result": "home",
      "predicted_score": {
        "home": 1,
        "away": 0
      },
      "probs": {
        "home": 0.42,
        "draw": 0.3,
        "away": 0.28
      }
    },
    {
      "match_id": "GS-25",
      "stage": "group_stage",
      "group": "E",
      "home_team": "GER",
      "away_team": "CUW",
      "predicted_result": "home",
      "predicted_score": {
        "home": 3,
        "away": 0
      },
      "probs": {
        "home": 0.85,
        "draw": 0.1,
        "away": 0.05
      }
    },
    {
      "match_id": "GS-26",
      "stage": "group_stage",
      "group": "E",
      "home_team": "CIV",
      "away_team": "ECU",
      "predicted_result": "away",
      "predicted_score": {
        "home": 1,
        "away": 1
      },
      "probs": {
        "home": 0.32,
        "draw": 0.32,
        "away": 0.36
      }
    },
    {
      "match_id": "GS-27",
      "stage": "group_stage",
      "group": "E",
      "home_team": "GER",
      "away_team": "CIV",
      "predicted_result": "home",
      "predicted_score": {
        "home": 2,
        "away": 0
      },
      "probs": {
        "home": 0.65,
        "draw": 0.22,
        "away": 0.13
      }
    },
    {
      "match_id": "GS-28",
      "stage": "group_stage",
      "group": "E",
      "home_team": "CUW",
      "away_team": "ECU",
      "predicted_result": "away",
      "predicted_score": {
        "home": 0,
        "away": 2
      },
      "probs": {
        "home": 0.15,
        "draw": 0.23,
        "away": 0.62
      }
    },
    {
      "match_id": "GS-29",
      "stage": "group_stage",
      "group": "E",
      "home_team": "GER",
      "away_team": "ECU",
      "predicted_result": "home",
      "predicted_score": {
        "home": 2,
        "away": 1
      },
      "probs": {
        "home": 0.55,
        "draw": 0.26,